{
  "name": "e2e-gated",
  "version": 1,
  "actors": {
    "haiku": {
      "kind": "executor",
      "brofile": "probe-haiku",
      "durable": true
    }
  },
  "start": "Decide",
  "nodes": {
    "Decide": {
      "actor": "haiku",
      "prompt": "Flip a mental coin. Output exactly one word — either YES or NO — in all caps. No other text.",
      "gate": "packet-05f4ba16",
      "next": {
        "type": "branch",
        "cases": { "yes": "Say_Yes", "no": "Say_No" }
      }
    },
    "Say_Yes": {
      "actor": "haiku",
      "prompt": "The coin came up YES. Say one short celebratory sentence. No preamble.",
      "next": { "type": "terminal" }
    },
    "Say_No": {
      "actor": "haiku",
      "prompt": "The coin came up NO. Say one short resigned sentence. No preamble.",
      "next": { "type": "terminal" }
    }
  }
}
